{
  "schema_version": 1,
  "attestation_id": "ordinary-declaration-validation.milestone-7.historical.v1",
  "recorded_at": "2026-08-31T15:30:00-04:00",
  "status": "FROZEN_HISTORICAL_MILESTONE_ATTESTATION",
  "historical_commit": "da6b56af92ce2bcbfa6f2f29a6f699b2f0b24c19",
  "artifacts": {
    "approved_authority_sources": {"path": "config/declaration-validation-approved-authority-sources.json", "sha256": "1c151df258514fd46f868593e09b18fe0b02e8dfe1c27fa4b92bcc682a830708", "git_commit": "da6b56af92ce2bcbfa6f2f29a6f699b2f0b24c19", "git_blob": "66c3e48f842f8cd95b85ccfd06253f7621862079"},
    "approved_authority_sources_schema": {"path": "schemas/declaration-validation-approved-authority-sources.schema.json", "sha256": "d4e9c78ab35302d7a56b193d87226a7943b8e85db6fdf89dd19d891ae367b325", "git_commit": "da6b56af92ce2bcbfa6f2f29a6f699b2f0b24c19", "git_blob": "ee35fc152fe3cfadbc77820d7bbad71c7a40e054"},
    "authority_rules": {"path": "config/declaration-validation-authority-rules.json", "sha256": "de56148f267eca9f1fd91c6f9a8d42f7786e1b946eb7565f704ccaa193838ea0", "git_commit": "da6b56af92ce2bcbfa6f2f29a6f699b2f0b24c19", "git_blob": "d5fb21bc589960d59be5b101e61b37d4ab00d11a"},
    "authority_rules_schema": {"path": "schemas/declaration-validation-authority-rules.schema.json", "sha256": "a770bd2a489d2764e6bb46db7b2d799c60c9fd62188c6ce7c4cf5b4de6cce012", "git_commit": "da6b56af92ce2bcbfa6f2f29a6f699b2f0b24c19", "git_blob": "d4621292409e7dad5149e5b1007cb34211af26ac"},
    "catalog": {"path": "config/declaration-validation-catalog.json", "sha256": "6320d20bf436d9f8ddff76ecbcab384f07c82a6a9d2766316b09a96f216093a5", "git_commit": "da6b56af92ce2bcbfa6f2f29a6f699b2f0b24c19", "git_blob": "d95373a991ba4b785fc44c763f8ab64295cf682c"},
    "catalog_schema": {"path": "schemas/declaration-validation-catalog.schema.json", "sha256": "c1ab29f7f45ec4e5ea2e7abbe47172b68fd2117214c0f2a906d64dc18bbf5f8a", "git_commit": "da6b56af92ce2bcbfa6f2f29a6f699b2f0b24c19", "git_blob": "d4a4af624b0e7c9768f391e8c5922fbe465fa897"},
    "completion_record": {"path": "results/research/declaration-validation-milestone-7.json", "sha256": "a2165c307984e8751ac22fa05a2d263104af05195524aa5f7782c2ea6b024573", "git_commit": "da6b56af92ce2bcbfa6f2f29a6f699b2f0b24c19", "git_blob": "80bc51b923e7fb024aaeb3aaca539f784a0381d5"},
    "completion_renderer": {"path": "scripts/render-declaration-validation-milestone-7-completion", "sha256": "c440355f61693f01f81cf9e1a58fad2f8daa407ad410a28ea9e9919c1d258868", "git_commit": "da6b56af92ce2bcbfa6f2f29a6f699b2f0b24c19", "git_blob": "f89d2f9d112d77bc6ee7f1eae387ac847188c235"},
    "completion_schema": {"path": "schemas/declaration-validation-milestone-7.schema.json", "sha256": "55276f59c50bec2482b164b739e9f844224397bcc0aea4ed189705c4c6d19c30", "git_commit": "da6b56af92ce2bcbfa6f2f29a6f699b2f0b24c19", "git_blob": "54ee4c3dca1f336f8b74e2677a284e0b1f184b6c"},
    "entry_schema": {"path": "schemas/declaration-validation-characterization-entry.schema.json", "sha256": "33f39e95a6d7c55088f10d4eb9dffea82eff83d77397a4ec5bb688e7a2a57ce6", "git_commit": "da6b56af92ce2bcbfa6f2f29a6f699b2f0b24c19", "git_blob": "bfa973e93b0a1cf6124106af385feb688c3c6c30"},
    "evidence_lock": {"path": "config/declaration-validation-evidence-locks/milestone-7.json", "sha256": "cb93d2f3f83fa23803dd47a94fcfe793c5cbd26170695988a2727fa09feb255c", "git_commit": "da6b56af92ce2bcbfa6f2f29a6f699b2f0b24c19", "git_blob": "25d6d4149e74566550dfb70dade9d724731f4024"},
    "evidence_lock_schema": {"path": "schemas/declaration-validation-evidence-lock.schema.json", "sha256": "45e0c7a69be059a371f4d33445cb7cdbdad21c542a82b07a7f1dfb65a6416adf", "git_commit": "da6b56af92ce2bcbfa6f2f29a6f699b2f0b24c19", "git_blob": "5ec468c8e6882f4f056c0af84a35c2dea4be75e7"},
    "freeze_manifest": {"path": "results/research/declaration-validation-milestone-7-freeze.json", "sha256": "070c7b4672c4eaf6a0e306a6d6578fab4246e8f454af553d66b7f3511bc82f2e", "git_commit": "da6b56af92ce2bcbfa6f2f29a6f699b2f0b24c19", "git_blob": "836e649df291f0d667370e3a4dfbc91f05f89243"},
    "freeze_manifest_schema": {"path": "schemas/declaration-validation-freeze-manifest.schema.json", "sha256": "b13d14ed4549ae1aca0f90d7ae65415f6f68257732b29ae7f1dda334a0027f2e", "git_commit": "da6b56af92ce2bcbfa6f2f29a6f699b2f0b24c19", "git_blob": "4952449c7b6c9ad0415466cb097365b929202551"},
    "freeze_renderer": {"path": "scripts/render-declaration-validation-freeze", "sha256": "71e66005186667aba3421db47214c92da9b84c6ae2bfffe3bf4facb8882a3ef9", "git_commit": "da6b56af92ce2bcbfa6f2f29a6f699b2f0b24c19", "git_blob": "f999e44fdc0f4f852e993f956e5eb65c8d6b866a"},
    "generated_report": {"path": "docs/research/DECLARATION_VALIDATION_OBLIGATIONS.md", "sha256": "85e75b29d705f014b54cf921d8d289d1f77db92ddb57eef388492eb329222e8f", "git_commit": "da6b56af92ce2bcbfa6f2f29a6f699b2f0b24c19", "git_blob": "2882156c5e94d8015dac93e6e4e7d2fe574d6557"},
    "identity_registry": {"path": "config/declaration-validation-identity-registry.json", "sha256": "68e8770c808518170a9a22766f8e2ea79d3d2bdf0b643101026d6ec55a69f230", "git_commit": "da6b56af92ce2bcbfa6f2f29a6f699b2f0b24c19", "git_blob": "f8f362f18e320290392000d86f7fb2ea9e0dac6e"},
    "invented_specification_fixture": {"path": "tests/fixtures/declaration-validation/invented-specification.md", "sha256": "18c8a2b9f17918fc10c0d0a441e6ac44e12636380c19a61552e72fc9a41caed4", "git_commit": "da6b56af92ce2bcbfa6f2f29a6f699b2f0b24c19", "git_blob": "3077481bd5368b323599ffaf9950164a686da9ab"},
    "milestone_4_completion": {"path": "results/research/declaration-validation-milestone-4.json", "sha256": "6de275bf61721249ac8265c9775042b239f9a781cf9c0f9d5d37b01b8b1db536", "git_commit": "da6b56af92ce2bcbfa6f2f29a6f699b2f0b24c19", "git_blob": "2242d9fb467492aa3f87d0a31c5c7d13f31b4a30"},
    "milestone_4_validator": {"path": "scripts/validate-declaration-validation-discovery-closure", "sha256": "390514dc2f151ca8c61d7196df6d3cb0f3a30253b90a7babd5a0783e0ce7689b", "git_commit": "da6b56af92ce2bcbfa6f2f29a6f699b2f0b24c19", "git_blob": "e896be5413d9ec8c75e535c0c57c589ef44902d3"},
    "post_catalog_decisions": {"path": "results/research/declaration-validation-catalog-decisions.json", "sha256": "b17b2ce8af273cfb7e8a2da768cd571d9201443b6e0077191eca7977660a1a2d", "git_commit": "da6b56af92ce2bcbfa6f2f29a6f699b2f0b24c19", "git_blob": "142d09f20344a8a8c25ee73b37d083468ccd0848"},
    "post_catalog_decisions_schema": {"path": "schemas/declaration-validation-catalog-decisions.schema.json", "sha256": "a23479855d7239d88ae19b39c3456dc0088b381adf7a244d29328502c7e1902b", "git_commit": "da6b56af92ce2bcbfa6f2f29a6f699b2f0b24c19", "git_blob": "12ca3791ce70cc62b70fcd6c704610912f5f4905"},
    "prior_identity_decisions": {"path": "results/research/declaration-validation-milestone-5-decisions.json", "sha256": "7ec0ae65d601ae5062ca5e8225bd23860cc9ceeeea44bb9fe73ee0cc8de39e32", "git_commit": "da6b56af92ce2bcbfa6f2f29a6f699b2f0b24c19", "git_blob": "ce496011999a3f7675ca5af259195aed51e9651e"},
    "report_renderer": {"path": "scripts/render-declaration-validation-report", "sha256": "428584944216d9ffe6310fb25e1ecab668624591c6d00defb55eeb686f46ea3a", "git_commit": "da6b56af92ce2bcbfa6f2f29a6f699b2f0b24c19", "git_blob": "7f0536b99c9d082d9345c84de94fdec20e8a601e"},
    "source_lock": {"path": "config/declaration-validation-source-lock.json", "sha256": "2ac3836b854392bc8302d78ed38d6a0f85b046fff8d16657a3a20af09d2fc88b", "git_commit": "da6b56af92ce2bcbfa6f2f29a6f699b2f0b24c19", "git_blob": "3c3bb433120189c46d81b0828d4f73ed740cef17"},
    "tests": {"path": "tests/test_declaration_validation_catalog.py", "sha256": "e15adaf594f1fb090e6fea532c511a772dd4aac691dbc05562650c9929b011f1", "git_commit": "da6b56af92ce2bcbfa6f2f29a6f699b2f0b24c19", "git_blob": "fba14cb7213f169aa1273d8b41347958d5610f50"},
    "validator": {"path": "scripts/validate-declaration-validation-catalog", "sha256": "5eaa7e64ad2e06f4550df6832ef030c22c366337ff98d01af13173f14d1d8489", "git_commit": "da6b56af92ce2bcbfa6f2f29a6f699b2f0b24c19", "git_blob": "18a27d5c2d2b315730471110b3b91e91f544aa95"}
  },
  "recovery": {
    "recovered_from_commit": "da6b56af92ce2bcbfa6f2f29a6f699b2f0b24c19",
    "later_mutable_rewrite_commit": "a9c52cc334886cebbeb8d38e47454c02b893613a",
    "reason": "The M8 pilot-hardening repair legitimately evolved the current catalog schema but also re-rendered mutable M7 paths. This attestation recovers the actual pre-M8 M7 bytes and makes their validation Git-blob-bound rather than current-path-bound."
  },
  "nonclaims": [
    "This historical attestation does not make the current canonical catalog a Milestone 7 artifact.",
    "Git-blob binding proves exact repository content, not semantic or epistemic sufficiency.",
    "The a9c52cc repair remains an auditable correction in repository history; this record does not erase it."
  ]
}
